{
  "$schema": "./sources-schema.json",
  "version": 1,
  "updatedAt": "2026-04-10",
  "description": "Curated skill repository sources - THE SINGLE SOURCE OF TRUTH",
  "sources": [
    { "source": "anthropics/skills", "name": "Anthropic Official", "official": true },
    { "source": "vercel-labs/agent-skills", "name": "Vercel Labs", "official": true },
    { "source": "expo/skills", "name": "Expo / React Native", "official": true },
    { "source": "remotion-dev/skills", "name": "Remotion Video", "official": true },
    { "source": "supabase/agent-skills", "name": "Supabase", "official": true },
    { "source": "stripe/ai", "name": "Stripe Payments", "official": true },
    { "source": "ComposioHQ/awesome-claude-skills", "name": "Composio Awesome" },
    { "source": "travisvn/awesome-claude-skills", "name": "Travis Awesome" },
    { "source": "mhattingpete/claude-skills-marketplace", "name": "Skills Marketplace" },
    { "source": "coreyhaines31/marketingskills", "name": "Marketing Skills" },
    { "source": "obra/superpowers", "name": "Superpowers TDD" },
    { "source": "softaworks/agent-toolkit", "name": "Softaworks Toolkit" },
    { "source": "wshobson/agents", "name": "Dev Patterns" },
    { "source": "langgenius/dify", "name": "Dify Frontend" },
    { "source": "trailofbits/skills", "name": "Trail of Bits Security" },
    { "source": "better-auth/skills", "name": "Better Auth" },
    { "source": "onmax/nuxt-skills", "name": "Nuxt / Vue" },
    { "source": "hyf0/vue-skills", "name": "Vue Best Practices" },
    { "source": "jezweb/claude-skills", "name": "Cloudflare / TanStack" },
    { "source": "elysiajs/skills", "name": "ElysiaJS / Bun" },
    { "source": "kadajett/agent-nestjs-skills", "name": "NestJS" },
    { "source": "callstackincubator/agent-skills", "name": "React Native" },
    { "source": "cloudai-x/threejs-skills", "name": "Three.js" },
    { "source": "emalorenzo/three-agent-skills", "name": "Three.js Advanced" },
    { "source": "dimillian/skills", "name": "SwiftUI iOS" },
    { "source": "waynesutton/convexskills", "name": "Convex Backend" },
    { "source": "kepano/obsidian-skills", "name": "Obsidian Notes" },
    { "source": "jimliu/baoyu-skills", "name": "Baoyu Tools" },
    { "source": "giuseppe-trisciuoglio/developer-kit", "name": "Shadcn / Radix" },
    { "source": "openrouterteam/agent-skills", "name": "OpenRouter SDK" },
    { "source": "intellectronica/agent-skills", "name": "Context7" },
    { "source": "muratcankoylan/Agent-Skills-for-Context-Engineering", "name": "Context Engineering" },
    { "source": "sickn33/antigravity-awesome-skills", "name": "Antigravity Awesome Skills" },
    { "source": "Xquik-dev/hermes-tweet", "name": "Hermes Tweet" },
    { "source": "NousResearch/hermes-agent", "name": "Hermes Agent Skills" },
    { "source": "skills.sh", "name": "Skills.sh Leaderboard", "official": true, "registry": "skills-sh" }
  ]
}
